63daabbd0ca8de9fc5709d1d	aa_opeds_sample/txt/419989695.xml.txt	"<div><p>Duff indictments a story you can sink teeth into</p><p style='font-size:12pt;font-weight:400;'>When the friends of the mayor of Chicago--friends from a family with connections to the Chicago Outfit--are about to be indicted by a federal grand jury in a $100 million <span style=""background-color:yellow;"">affirmative-action</span> contract fraud scheme, word gets around fast.</p><p style='font-size:12pt;font-weight:400;'>So last week, word about the Duffs fanned out from City Hall.</p><p style='font-size:12pt;font-weight:400;'>But there were a couple hours to kill before U.S. Atty. Patrick Fitzgerald's Thursday news conference about the Duff financial empire. It was time for lunch; I was hungry and wanted to think this through. There was only one place to go.</p><p style='font-size:12pt;font-weight:400;'>""You've just got to go to Gene's,"" said a friend and colleague. She meant my favorite steakhouse, and the Duffs' favorite steakhouse, Gene & Georgetti's.</p><p style='font-size:12pt;font-weight:400;'>Gene's is a hangout where information is traded, among politicians, insiders, reporters, wise-guys, salesmen, consultants, from the buttoned down to the gold chains crowd. And what makes it work is that they serve the best steak in the city, period. The service is impeccable without being showy and the drinks are honest. Gene's is a part of the old Chicago, the city as it was before so much of the downtown was turned into a theme park.</p><p style='font-size:12pt;font-weight:400;'>It's also the place where the Duffs came up to me about a year ago, their tough, hard eyes smiling. They asked me why they don't ever see my children playing in the front yard of my home in the suburbs. They asked it twice.</p><p style='font-size:12pt;font-weight:400;'>But the columns didn't stop and neither did the news stories by the investigative reporters, or Tribune editorials about the mayor's friends. And here's why:</p><p style='font-size:12pt;font-weight:400;'>This is not about getting personal with the mayor or the Duffs. Though the mayor has been a frequent target in my column, what drives the criticism is the obscene amounts of taxpayer dollars that go to his pals. In deal after deal after deal, the attitude is that his guys can take what they want and the people in the neighborhoods better shut up about it, while higher taxes put more and more pressure on families to pay for the deals.</p><p style='font-size:12pt;font-weight:400;'>It's not personal, it's business, and it's your money.</p><p style='font-size:12pt;font-weight:400;'>Daley is an able politician and has done some good things, including taking personal responsibility for trying to improve the public schools. But he must also take personal responsibility for his friends who get rich on government contracts he controls, paid for by our tax dollars.</p><p style='font-size:12pt;font-weight:400;'>The Duff stories broke in 1999, when Tribune investigative reporters Ray Gibson, Andrew Martin and Laurie Cohen wrote about the Duffs' City Hall deals and their connections to Daley and the Outfit. You can find the archive of the stories available on the Tribune's Web site.</p><p style='font-size:12pt;font-weight:400;'>Much of what was alleged in the indictments was laid out in those stories: that the Duffs, who are white, ran phony front companies that got $100 million in city contracts that should have gone to firms owned by women or minorities.</p><p style='font-size:12pt;font-weight:400;'>Daley knew the Duffs were not minorities, even when he was a crime-fighting Cook County state's attorney. A Duff sits across from you, gives you campaign cash, pours a drink, it's reasonable to assume that even the mayor could tell whether the person was white or not.</p><p style='font-size:12pt;font-weight:400;'>Think back to how the media treated the late Mayor Harold Washington, when Washington's buddies were involved in contract scandals. Back then, even minor stories about corruption got sustained media attention, particularly from TV and radio, even if the dollar amounts were only chump change. Washington faced constant media pressure on corruption issues. TV crawled all over him for years.</p><p style='font-size:12pt;font-weight:400;'>""If I was white, you wouldn't be doing this to me,"" Washington said once, in a private moment, as he filched a smoke from me and we stood in a parking lot after a campaign stop. We argued about it, and I told him that since we were off the record, he didn't have to play the race card. ""You don't know anything, do you?"" he said. He was right. I was a kid, then. I didn't know.</p><p style='font-size:12pt;font-weight:400;'>But when the Duff stories first broke, involving a white mayor and white guys getting rich, the Chicago media scrutiny wasn't as intense. TV news didn't hound Daley the way it hounded Washington. The mayor must appreciate the kindness.</p><p style='font-size:12pt;font-weight:400;'>I'm sure he also appreciates the new federal prosecutor, Patrick Fitzgerald. The feds have already outflanked former Gov. George Ryan's Republicans. Ryan himself is a target. And now the feds are moving toward Daley's Democratic City Hall.</p><p style='font-size:12pt;font-weight:400;'>The Daley-Duff relationship is not just a Tribune story anymore. A group of citizens--sworn as federal grand jurors--looked at the evidence. They didn't find a flaw in the system, as the city claims. They found a crime.</p><p style='font-size:12pt;font-weight:400;'>A couple friends and I talked of this at Gene's, about the change in things, about the importance of an independent federal prosecutor, about how the bipartisan political clique that runs this state tried to stop Fitzgerald's appointment in hopes of installing one of their own.</p><p style='font-size:12pt;font-weight:400;'>Just then, the cell phones began chirping and word of the Duff indictments began to spread through the bar.</p><p style='font-size:12pt;font-weight:400;'>We had our steaks medium rare. And they were tasty.</p><p style='font-size:12pt;font-weight:400;'>----------</p><p style='font-size:12pt;font-weight:400;'>jskass@tribune.com</p></div>"	3				3			
63daabbd0ca8de9fc5709d1d	aa_opeds_sample/txt/2831679997.xml.txt	"<div><p>This Supreme Court pits us against them</p><p style='font-size:12pt;font-weight:400;'>I'm picking out a suit to wear tonight because I'm going to a wedding for a longtime friend. We used to be roommates long ago, and she's finally marrying her partner of 10 years.</p><p style='font-size:12pt;font-weight:400;'>When she told me she was getting married, she did all the usual things that people who are about to be married do. She showed me a picture of her dress, and we talked about the kind of cake they were going to get. In the end, she and her partner decided they'd have a quick wedding in Las Vegas and then do another, more formal ceremony back east in the city where we live. That's this evening, and I'm happy for both of them.</p><p style='font-size:12pt;font-weight:400;'>I used the word ""partner"" in an attempt to be intentionally vague. But I'll tell you now that the bride is a cisgender woman. Her husband is a cisgender man. In short, it's the kind of wedding that conservatives believe is the only kind of wedding that counts.</p><p style='font-size:12pt;font-weight:400;'>But there's a more complex aspect to their nuptials. She is bisexual and proudly so. It just so happens that she fell in love with a man. She has had many relationships with women. Had she fallen in love with a woman, it's quite possible that the seamstress could have refused to alter her dress, the bakery could have refused to make her a cake. But she avoided all of that by marrying a man.</p><p style='font-size:12pt;font-weight:400;'>The U.S. Supreme Court has been very busy lately making clear which kinds of people it truly values. By striking down Roe v. Wade, the justices showed us how much they value the opinions of women who want a say in their own health care. By striking down <span style=""background-color:yellow;"">affirmative action</span>, they showed us how much they value White over Black and Brown students. By striking down student loan forgiveness, they demonstrated how much they value those who don't have enough money to avoid the Ponzi scheme called student loans. And today they essentially legalized the unequal treatment of LGBTQ people by holding that discrimination is a small price to pay if it lifts up just one kind of love.</p><p style='font-size:12pt;font-weight:400;'>This Supreme Court has become a conservative dreamland: Out of touch with the country and determined to satisfy conservatives who think they win only when someone else loses.</p><p style='font-size:12pt;font-weight:400;'>Lorie Smith, the Colorado web designer who refuses to make websites for LGBTQ people, may experience a boom in her business. This legal action was the best thing she could have done to make that happen. I don't know if she's a particularly good web designer or not, but I do know she will be lionized in some circles because she helped make people who conservatives don't like suffer.</p><p style='font-size:12pt;font-weight:400;'>This need by conservatives is not about faith, really. It's about ensuring that Americans they don't know and don't like will suffer. They consider it a win for White people when Black and Brown people suffer. A win for men when women suffer. A win for older, richer people when younger, poorer people suffer. Everything in their minds is binary. We win. You lose. Black and white. And our current Supreme Court has become the favored weapon in their arsenal to bring about heartache for those they don't like.</p><p style='font-size:12pt;font-weight:400;'>And it won't end here. Because whatever lines the justices may think they have carefully drawn during this term, their benefactors in the deep conservative world are just getting warmed up. Get ready for more: More behavior on your part that they will essentially outlaw. More things we're not allowed to teach. More roads for access unceremoniously cut off. More rights trampled on, and more barriers to discrimination lowered. Because the main priority of our conservative Supreme Court is to keep the status quo secure. Solid. And that means keeping certain people down.</p><p style='font-size:12pt;font-weight:400;'>So, I will go to my friend's wedding in a few hours. And I will smile and have a good time, and I will be happy for her. There will be other LGBTQ friends of hers in attendance, and none of us would dream of sullying her day by reminding her that she's unintentionally made a choice that now, thanks to six people in Washington, places her above us in the American hierarchy of who matters most.</p><p style='font-size:12pt;font-weight:400;'>She was never put in a position to have her right to the pursuit of happiness questioned.</p></div>"			2		3			
63daabbd0ca8de9fc5709d1d	aa_opeds_sample/txt/409060590.xml.txt	"<div><p>Ashcroft The Activist</p><p style='font-size:12pt;font-weight:400;'>Opponents of John Ashcroft's nomination to become attorney general have been turning over every rock in sight, hoping to find some outrageous statement, some political skeleton, some evidence that he is unfit to be the nation's chief law enforcement officer.</p><p style='font-size:12pt;font-weight:400;'>His supporters have been doing their best to prove that the nominee is technically qualified for the job and is, moreover, a decent man who would enforce the law fairly.</p><p style='font-size:12pt;font-weight:400;'>The whole thing seems to be missing the point. I have never doubted Ashcroft's decency, never questioned his legal abilities, never worried that, in a particular case, he would be unfair.</p><p style='font-size:12pt;font-weight:400;'>But the attorney general is not just the nation's chief cop. He is also the chief influencer of our law-enforcement policy.</p><p style='font-size:12pt;font-weight:400;'>It is from that office that decisions are made on which laws to enforce, and how vigorously; what discretion ought to be exercised, and in which direction; how law-enforcement resources should be deployed, and with what emphases. Bland reassurances that Ashcroft would ""enforce the law fairly"" aren't much help.</p><p style='font-size:12pt;font-weight:400;'>To take a simple example, what does it mean to enforce America's drug laws ""fairly""? Does it mean locking up anybody caught with illegal drugs, as the law permits? Does it mean focusing resources on major traffickers, as the law also permits? Does it mean shifting resources from enforcement to treatment -- or the other way around? Does it mean confiscating more and more assets of people found in violation of the drug laws? The law allows all these things -- allows as well the disparate sentencing for powdered and ""crack"" cocaine and the well-documented racial disparity that results from it.</p><p style='font-size:12pt;font-weight:400;'>To promise to enforce the law without talking about which policies would be emphasized or changed is to say nothing at all. Absent a president with strong feelings on the matter,  law-enforcement policy is largely left to attorneys general to decide. Some have gone against discrimination, some against organized crime, some against monopolies and trusts. Some have followed public sentiment, and some have gone their own way. Most of the time, it hasn't mattered much. So why do so many non-conservatives believe it will matter so much this time?</p><p style='font-size:12pt;font-weight:400;'>The answer is in Ashcroft's record of advocacy. He has fought with extraordinary vigor for positions that are well outside the American mainstream -- on gun control, on abortion, on juvenile justice, on the death penalty. I don't mean to deny that his position on all these issues might be shared by a significant minority. I say only that his views are unusually conservative. He is, I think it fair to say, an ideologue. And when you take someone who has been advocating views that are well away from the political center and put him in charge of law-enforcement policy, it's not enough to say he'll ""enforce the law.""</p><p style='font-size:12pt;font-weight:400;'>Ashcroft signaled his own understanding of this point when he was asked whether he would try to undermine the 1973 Roe v. Wade decision on abortion. He said that for the solicitor general (who ranks under the attorney general) to petition the Supreme Court to have another look at Roe would undermine the Justice Department's standing before the court.</p><p style='font-size:12pt;font-weight:400;'>He was, as I read his response, saying he could make the attempt, though it might be impolitic to do so at this time.</p><p style='font-size:12pt;font-weight:400;'>Is it unfair to oppose Ashcroft, an experienced lawyer, out of fear that his personal and religious views would influence his role as attorney general?</p><p style='font-size:12pt;font-weight:400;'>As Sen. Patrick Leahy (D-Vt.) reminded us the other day, it is a question Ashcroft himself has answered. When Bill Lann Lee was named by President Clinton to head the Justice Department's civil rights division, Ashcroft fought to deny him the job.</p><p style='font-size:12pt;font-weight:400;'>He had no doubt concerning the nominee's professional ability, Ashcroft said at the time, but Lee's beliefs (on <span style=""background-color:yellow;"">affirmative action</span>) ""limit his capacity to have the balanced view of making judgments that will be necessary for the person who runs the division.""</p><p style='font-size:12pt;font-weight:400;'>Why can't the same assessment apply to the person who will run the whole department?</p></div>"		1			3			
63daabbd0ca8de9fc5709d1d	aa_opeds_sample/txt/2154417607.xml.txt	"<div><p>Racial Preferences Aren't Only an American Problem; Discriminatory programs tend to benefit the well-off instead of the poor. And they never seem to end.</p><p style='font-size:12pt;font-weight:400;'>The Paris protesters are getting all the attention, but France isn't the only country where angry masses are taking to the streets to be heard.</p><p style='font-size:12pt;font-weight:400;'>The Journal reported Monday that an estimated 55,000 people gathered in the Malaysian capital of Kuala Lumpur last weekend to defend race-based policies that give preferential treatment to the majority Muslim Malay population. Defenders argue that ending racial preferences would ""dilute decades of <span style=""background-color:yellow;"">affirmative action</span> policies introduced to help Malays catch up with the generally wealthier ethnic Chinese,"" who comprise less than a quarter of the population.</p><p style='font-size:12pt;font-weight:400;'><span style=""background-color:yellow;"">Affirmative action</span> in Malaysia began in the 1950s, after the British colonial administrators, who had welcomed laborers from China, departed. Since 1971, Malays have enjoyed preferential treatment over their Chinese compatriots in everything from schooling and housing to government jobs and access to capital. The government's express goal was ""racial balance,"" and to that end Malay entrepreneurs were given preference in obtaining credit, licenses and government contracts. Developers offer Malays discounts on new homes, and shopping centers have even banned ethnic-Chinese-owned businesses to limit competition with Malay proprietors.</p><p style='font-size:12pt;font-weight:400;'>These policies were supposed to sunset in 1991, but the country's leaders have repeatedly extended them in exchange for political support. ""Schemes favouring Malays were once deemed essential to improve the lot of Malaysia's least wealthy racial group,"" explains the Economist magazine, but ""these days they are widely thought to help mostly the well-off within that group, while failing the poor and aggravating ethnic tensions.""</p><p style='font-size:12pt;font-weight:400;'>To anyone who has followed the <span style=""background-color:yellow;"">affirmative-action</span> debate in the U.S., a lot of this probably sounds familiar. Like their Malay counterparts, American proponents of racial double standards say they are necessary to help the underprivileged, even though the beneficiaries tend to be people who were already well-off to begin with. Liberal politicians defend color-conscious policies to win votes, and courts assure us the policies will not exist in perpetuity. ""We expect that 25 years from now, the use of racial preferences will no longer be necessary,"" wrote Justice Sandra Day O'Connor in a 2003 Supreme Court decision.</p><p style='font-size:12pt;font-weight:400;'>As it has in Malaysia, <span style=""background-color:yellow;"">affirmative action</span> continues to stoke racial and ethnic tensions in the U.S., especially in education. Harvard is being sued for discrimination against Asian applicants. The plaintiffs say Asians are held to higher standards than other applicants to limit their numbers on campus. Harvard insists that more Asians aren't admitted because they aren't as multidimensional as their non-Asian peers, an argument eerily similar to the one Ivy League schools once used to discriminate against Jews.</p><p style='font-size:12pt;font-weight:400;'>In New York, Mayor Bill de Blasio has angered the parents of white and Asian students by pushing for racial quotas at the city's top public high schools. Some 80% of black and Hispanic students in New York City's traditional public schools perform below grade level in reading and math. Is it really any wonder that black and Hispanic students are underrepresented at elite schools that use an admission test? Unfortunately, the mayor and his supporters would rather scrap the test than focus on doing a better job of preparing kids to take it.</p><p style='font-size:12pt;font-weight:400;'>While the debate domestically often centers on the legality of <span style=""background-color:yellow;"">affirmative action</span> and whether it's permitted under our constitution, a more practical concern is whether these policies actually work as intended--here in America or in other countries where they've been implemented. Malaysia's racial preferences have been in place for more than 50 years, and the Malays still haven't caught up to the ethnic Chinese, who outperform them in school and in the workforce. The gap has narrowed over the past half-century, but it remains significant, and attributing Malay progress to <span style=""background-color:yellow;"">affirmative action</span> is dubious. For one thing, Malays in neighboring Singapore, which has no <span style=""background-color:yellow;"">affirmative action</span> and where they are a minority, are better off economically than the Malays in Malaysia, who receive favorable treatment.</p><p style='font-size:12pt;font-weight:400;'>Similarly, <span style=""background-color:yellow;"">affirmative-action</span> programs in the U.S. are regularly given undeserved credit for expanding the size of the black middle class. The reality is that the most dramatic declines in black poverty preceded <span style=""background-color:yellow;"">affirmative-action</span> programs, which began in earnest in the 1970s. Black incomes doubled in the 1960s--before <span style=""background-color:yellow;"">affirmative action</span>. And blacks were entering middle-class professions at a much faster clip in the decades preceding <span style=""background-color:yellow;"">affirmative action</span> than they did in the decades following its implementation.</p><p style='font-size:12pt;font-weight:400;'>After the University of California system ended race-based admissions in 1996, more blacks enrolled and a higher percentage of them not only graduated but obtained degrees in the more challenging fields of engineering and science. Policies intended to help sometimes do the opposite, whether they are implemented in the U.S. or halfway around the world.</p><p style='font-size:12pt;font-weight:400;'>Credit: By Jason L. Riley</p></div>"		1		2				
