user	instance_id	displayed_text	affirmative_action_relevance:::Affirmative action is not mentioned.	affirmative_action_relevance:::Affirmative action is the main subject.	affirmative_action_relevance:::Affirmative action is mentioned, but is not the main subject	affirmative_action_stance:::Somewhat against	affirmative_action_stance:::Neutral, or not enough information	affirmative_action_stance:::Strongly against	affirmative_action_stance:::Somewhat in favor	affirmative_action_stance:::Strongly in favor
5dafe439670a30001634eaa0	aa_opeds_sample/txt/422316037.xml.txt	"<div><p>SOTOMAYOR CONFIRMATION HEARING / REACTIONS; 'Mastered the art of saying a lot while saying very little'</p><p style='font-size:12pt;font-weight:400;'>Wrapping up four days of grilling, Republicans on the Senate Judiciary Committee considering Sonia Sotomayor's Supreme Court nomination dominated Thursday with appeals for the prospective justice to protect national security, fight the growing deficit and heed Americans' commitment to the right to keep and bear arms, and they admonished her not to engage in judicial activism. Legal analysts said she succeeded in maintaining the profile of a moderate who would bring an open mind to the weighty legal issues likely to come to the high court.</p><p style='font-size:12pt;font-weight:400;'>--</p><p style='font-size:12pt;font-weight:400;'>Erwin Chemerinsky</p><p style='font-size:12pt;font-weight:400;'>Constitutional law scholar and dean of UC Irvine School of Law</p><p style='font-size:12pt;font-weight:400;'>""In the end, I think the confirmation process served two purposes: It gave the senators a chance to speak to their base, and it gave the American people the opportunity to listen to Sonia Sotomayor. But it gave no one any real sense of what she is going to be like as a justice on the Supreme Court. . . .</p><p style='font-size:12pt;font-weight:400;'>""She did a wonderful job of following a script that gives such a misleading and inaccurate impression of what Supreme Court justices really do. She said many times that judges apply the law, they don't make the law. Every first-year law student learns that judges make the law. Everything the Supreme Court does makes law, by definition.</p><p style='font-size:12pt;font-weight:400;'>""There were places where she was willing to go further in a conservative direction than I would have expected her to do. We heard her firmly rejecting the use of foreign constitutional law in American decision-making. She described the Constitution as static, not evolving. I think she went further to try to appease the conservatives . . . but I think she succeeded in ensuring that her confirmation will go through smoothly.""</p><p style='font-size:12pt;font-weight:400;'>--</p><p style='font-size:12pt;font-weight:400;'>Ilya Shapiro</p><p style='font-size:12pt;font-weight:400;'>Cato Institute senior fellow and editor of its Supreme Court Review</p><p style='font-size:12pt;font-weight:400;'>""She filibustered well. . . . The sharper the Republicans got in their questioning, and they kept refining and working out what needed to be probed further, the more she mastered the art of saying a lot while saying very little. It seems like she was running out the clock. . . .</p><p style='font-size:12pt;font-weight:400;'>""She had a pattern of saying things that were good and should assuage people, but it was the exact opposite of what she said in previous speeches. She declined to either approve of or criticize the citing of foreign law in some death penalty cases. There was some frustration on the side of the senators that she wasn't answering.</p><p style='font-size:12pt;font-weight:400;'>""I am less favorable toward her than I was when the hearing started because of the manner in which she responded . . . to pretend to answer the question.""</p><p style='font-size:12pt;font-weight:400;'>--</p><p style='font-size:12pt;font-weight:400;'>Kimberly West-Faulcon</p><p style='font-size:12pt;font-weight:400;'>Constitutional law professor at Loyola Law School</p><p style='font-size:12pt;font-weight:400;'>""It was an interesting discussion on identity politics when they were asking her if she was a participant in such. It was the Republican senators playing identity politics themselves, appealing to the fears of white Americans about the prospects for nonwhites attaining positions of authority. They ignored her explanations of the procedural posture of decision-making in the Ricci case [white Connecticut firefighters claiming discrimination], despite the overwhelming views of commentators that the Supreme Court did make new law in deciding that case.</p><p style='font-size:12pt;font-weight:400;'>""Today was much more about creating the opportunity to drive in that particular wedge issue of <span style=""background-color:yellow;"">affirmative action</span> than about vetting Sonia Sotomayor. . . . A lot of what today was about was the Republican senators, who monopolized the hearing today, putting forth their own ideology and legal philosophy. . . .</p><p style='font-size:12pt;font-weight:400;'>""As to how she came out in the confirmation hearing, I think she looked fabulous and accomplished the goal of appearing judicious. She left an overall impression of a moderate judge who is restrained. To the extent that was her goal and that of the Democratic senators, it was achieved.""</p><p style='font-size:12pt;font-weight:400;'>--</p><p style='font-size:12pt;font-weight:400;'>carol.williams@latimes.com</p></div>"			2		3			
5dafe439670a30001634eaa0	aa_opeds_sample/txt/432876223.xml.txt	"<div><p>O.K., Students, a Final Exam</p><p style='font-size:12pt;font-weight:400;'>1. When asked in March 2002 why he rarely mentioned Osama bin Laden anymore, which three of these statements did Mr. Bush make?</p><p style='font-size:12pt;font-weight:400;'>a) Osama who?</p><p style='font-size:12pt;font-weight:400;'>b) I know he is on the run.</p><p style='font-size:12pt;font-weight:400;'>c) I truly am not that concerned about him.</p><p style='font-size:12pt;font-weight:400;'>d) He's just another one of the dead-enders.</p><p style='font-size:12pt;font-weight:400;'>e) We haven't heard much from him. And I wouldn't necessarily say he's at the center of any command structure.</p><p style='font-size:12pt;font-weight:400;'>2. When Tom Brokaw asked Mr. Kerry about a report that Mr. Bush's I.Q. was higher than his, how did he respond?</p><p style='font-size:12pt;font-weight:400;'>a) But he doesn't even speak French.</p><p style='font-size:12pt;font-weight:400;'>b) I've never misunderestimated his intelligence.</p><p style='font-size:12pt;font-weight:400;'>c) That's great. More power.</p><p style='font-size:12pt;font-weight:400;'>d) This just shows, once again, that the president has been deliberately hiding the truth from the American public.</p><p style='font-size:12pt;font-weight:400;'>e) It's a great boost in our campaign to connect with voters who are still trying to figure out which candidate to support. I mean, these folks are obviously not Mensa material.</p><p style='font-size:12pt;font-weight:400;'>3. How did President Bush propose to save Social Security?</p><p style='font-size:12pt;font-weight:400;'>a) Raise the retirement age to 90.</p><p style='font-size:12pt;font-weight:400;'>b) Impose an excise tax on cruise-ship fares and early-bird-special meals.</p><p style='font-size:12pt;font-weight:400;'>c) Encourage the exportation of Medicare recipients to Canada.</p><p style='font-size:12pt;font-weight:400;'>d) Allow young workers to invest contributions in private savings accounts.</p><p style='font-size:12pt;font-weight:400;'>e) Deny flu shots to senior citizens.</p><p style='font-size:12pt;font-weight:400;'>4. A Kerry commercial titled ''January Surprise'' warns that ''Bush has a plan to cut Social Security benefits by 30 to 45 percent.'' The campaign bases this on one of several options proposed by a bipartisan commission, but not endorsed by Mr. Bush, to peg future benefit increases to consumer prices instead of wages. What is the current age of the oldest American who would hypothetically be affected by the 45 percent differential cited in the commercial?</p><p style='font-size:12pt;font-weight:400;'>a) 4</p><p style='font-size:12pt;font-weight:400;'>b) 14</p><p style='font-size:12pt;font-weight:400;'>c) 24</p><p style='font-size:12pt;font-weight:400;'>d) 34</p><p style='font-size:12pt;font-weight:400;'>e) 44</p><p style='font-size:12pt;font-weight:400;'>5. Which two of the following animals have been featured in advertisements supporting Mr. Bush?</p><p style='font-size:12pt;font-weight:400;'>a) A mountain lion defending its den.</p><p style='font-size:12pt;font-weight:400;'>b) Wolves lurking at the edge of a forest.</p><p style='font-size:12pt;font-weight:400;'>c) Flying monkeys abducting a troop of Girl Scouts.</p><p style='font-size:12pt;font-weight:400;'>d) A white poodle, wearing a Kerry sweater and a pink bow, captioned ''That dog don't hunt.''</p><p style='font-size:12pt;font-weight:400;'>e) A squawking chicken being chased by a butcher wearing a checkered headdress.</p><p style='font-size:12pt;font-weight:400;'>6. Which two of the following animals have been featured in advertisements supporting Mr. Kerry?</p><p style='font-size:12pt;font-weight:400;'>a ) A soaring eagle.</p><p style='font-size:12pt;font-weight:400;'>b) A bull in a Pottery Barn smashing a set of china labeled ''Iraq.''</p><p style='font-size:12pt;font-weight:400;'>c) A watchdog sleeping while foxes carry off chickens and sticks of dynamite.</p><p style='font-size:12pt;font-weight:400;'>d) An ostrich with its head in the sand.</p><p style='font-size:12pt;font-weight:400;'>e) Three blind mice searching for a piece of cheese labeled ''W.M.D.''</p><p style='font-size:12pt;font-weight:400;'>7. Last week Mr. Kerry criticized Mr. Bush over the disappearance of explosives from a site in Iraq. What is the name of the site?</p><p style='font-size:12pt;font-weight:400;'>a) Al Qaeda</p><p style='font-size:12pt;font-weight:400;'>b) Al Dente</p><p style='font-size:12pt;font-weight:400;'>c) Al Qaqaa</p><p style='font-size:12pt;font-weight:400;'>d) Al Qaselzur</p><p style='font-size:12pt;font-weight:400;'>e) Al Roker</p><p style='font-size:12pt;font-weight:400;'>8. In a survey of 980 people stopped on the street in 10 cities, the Pere Partnership advertising agency asked respondents how their votes were swayed by the political activism of Charlton Heston, Michael Moore and Bruce Springsteen. What was the most common response?</p><p style='font-size:12pt;font-weight:400;'>a) It swayed me to vote for the celebrity's candidate.</p><p style='font-size:12pt;font-weight:400;'>b) It swayed me to vote for the other candidate.</p><p style='font-size:12pt;font-weight:400;'>9. In the same survey, respondents were asked to name the celebrity whose endorsement was least likely to make them vote for a presidential candidate. Here are the four names mentioned the most often. Place them in order, starting with the celebrity least likely to sway anyone's vote.</p><p style='font-size:12pt;font-weight:400;'>a) Martha Stewart.</p><p style='font-size:12pt;font-weight:400;'>b) O.J. Simpson</p><p style='font-size:12pt;font-weight:400;'>c) Paris Hilton</p><p style='font-size:12pt;font-weight:400;'>d) Mike Tyson</p><p style='font-size:12pt;font-weight:400;'>10. What phrase did the Kerry campaign use to describe the coalition assembled by President Bush in Operation Iraqi Freedom?</p><p style='font-size:12pt;font-weight:400;'>a) A coalition of the coerced and the bribed.</p><p style='font-size:12pt;font-weight:400;'>b) A bunch of yo-yos.</p><p style='font-size:12pt;font-weight:400;'>c) The unspeakable in search of the incredible.</p><p style='font-size:12pt;font-weight:400;'>d) The gang that couldn't shoot straight.</p><p style='font-size:12pt;font-weight:400;'>e) N.O.C.D. (Not our class, dear).</p><p style='font-size:12pt;font-weight:400;'>11. During the second presidential debate, what position did Mr. Bush say he would find unacceptable in a Supreme Court justice?</p><p style='font-size:12pt;font-weight:400;'>a) Pro-euthanasia.</p><p style='font-size:12pt;font-weight:400;'>b) Pro-abortion.</p><p style='font-size:12pt;font-weight:400;'>c) Pro-fluoridation.</p><p style='font-size:12pt;font-weight:400;'>d) Pro-<span style=""background-color:yellow;"">affirmative action</span>.</p><p style='font-size:12pt;font-weight:400;'>e) Pro-slavery.</p><p style='font-size:12pt;font-weight:400;'>12. When asked by Bob Woodward if he had consulted with his father about the decision to invade Iraq, what did President Bush say?</p><p style='font-size:12pt;font-weight:400;'>a) Wouldn't have been prudent.</p><p style='font-size:12pt;font-weight:400;'>b) I would have if he'd won a second term.</p><p style='font-size:12pt;font-weight:400;'>c) He is the wrong father to appeal to in terms of strength. There is a higher father that I appeal to.</p><p style='font-size:12pt;font-weight:400;'>d) Just because someone has defeated Saddam Hussein once doesn't make him an expert.</p><p style='font-size:12pt;font-weight:400;'>e) I tried, but he was stuck on this notion that it would take a lot of troops.</p><p style='font-size:12pt;font-weight:400;'>13. What new strategy is the Kerry campaign planning for Ohio on Tuesday?</p><p style='font-size:12pt;font-weight:400;'>a) Carrying voters to the polls in sedan chairs.</p><p style='font-size:12pt;font-weight:400;'>b) Posting security guards along Lake Erie to prevent Mr. Kerry from windsurfing.</p><p style='font-size:12pt;font-weight:400;'>c) Promising toasters to the first 10 voters at each polling place.</p><p style='font-size:12pt;font-weight:400;'>d) Employing a ''snack czar'' to hand out food to voters in line.</p><p style='font-size:12pt;font-weight:400;'>e) Assigning each voter a ''personal lawyer.''</p><p style='font-size:12pt;font-weight:400;'>14. According to The Associated Press, a Democratic politician campaigning for Mr. Kerry in Florida declared, ''If we were living in another country and we had the president of the country and his brother controlling one of the biggest provinces or states, we would ... have some doubts about whether, given their track record, they really believe in democracy.'' Who said it?</p><p style='font-size:12pt;font-weight:400;'>a) A former vice president and senator whose father was a senator.</p><p style='font-size:12pt;font-weight:400;'>b) A senator of a populous state whose brothers served simultaneously as president and attorney general.</p><p style='font-size:12pt;font-weight:400;'>c) A congressman who is the son of the senator whose brothers served as president and attorney general.</p><p style='font-size:12pt;font-weight:400;'>d) A former cabinet official whose father was governor of one of the biggest states and who married the niece of the senator whose brothers served as president and attorney general.</p><p style='font-size:12pt;font-weight:400;'>e) A senator elected in one of the biggest states while her husband was president.</p><p style='font-size:12pt;font-weight:400;'>15. Identify Hans Blix.</p><p style='font-size:12pt;font-weight:400;'>a) A former United Nations weapons inspector.</p><p style='font-size:12pt;font-weight:400;'>b) A Norwegian laundry detergent.</p><p style='font-size:12pt;font-weight:400;'>c) The leader described by Mr. Bush as the ''Danishian prime minister.''</p><p style='font-size:12pt;font-weight:400;'>d) A character on ''Saturday Night Live'' who mocked ''girlie-men.''</p><p style='font-size:12pt;font-weight:400;'>e) One of Santa's reindeer.</p><p style='font-size:12pt;font-weight:400;'>Answers1:b, c, e; 2:c; 3:d; 4:a; 5:b, d; 6:a, d; 7:c; 8:b; 9:c, b, d, a; 10:a; 11:e; 12:c; 13:d; 14:e; 15:a.</p><p style='font-size:12pt;font-weight:400;'>Drawings (Illustrations by Stephen Savage)</p></div>"			2		3			
5dafe439670a30001634eaa0	aa_opeds_sample/txt/398788879.xml.txt	"<div><p>Stranger Than Fiction</p><p style='font-size:12pt;font-weight:400;'>LONDON -- New York literary agents, take note of this plot for a thriller:</p><p style='font-size:12pt;font-weight:400;'>A heavily armed band of Latinos -- call them the Hispanic Republican Army -- is determined to return the oppressed American ""colony"" of Texas to Mexico. Never mind that a majority of Texans like being American citizens; these freedom-fighters aren't big on the fine print of democracy.</p><p style='font-size:12pt;font-weight:400;'>Over three decades, the HRA bombs bars in Austin and Houston, killing about 500 civilians, including (accidents will happen) scores of Mexican immigrants. Its members murder state and federal judges, and any fellow Latinos caught ""collaborating"" with Texas state troopers, including caterers and garbage men. They assassinate over 300 policemen. When Washington activates the National Guard to keep the peace, 700 American servicemen wind up in boxes. And while most decent, hard-working Latinos in Texas don't support the HRA, they also don't mind all the <span style=""background-color:yellow;"">affirmative action</span> coming their way since the ruckus started.</p><p style='font-size:12pt;font-weight:400;'>Airport novels must constantly raise the stakes, so we can't have the HRA constraining itself to Texas. Equipped by Libya's Moammar Gadhafi, the HRA bombs Wall Street, causing billions of dollars in damage. In fact, the World Trade Center bombing of 1992 could easily be the work of these militants. They mortar-bomb the White House, and make unnervingly near-successful assassination attempts on both Ronald Reagan and George Bush Sr.</p><p style='font-size:12pt;font-weight:400;'>Is the American public enraged? Quite the opposite: It's bored. Another bombing in El Paso? Big deal. Texas seems far away, and a thorn in the side. Maybe it would be a relief to shed the place, which doesn't even generate much oil revenue anymore.</p><p style='font-size:12pt;font-weight:400;'>Here the plot may take a turn toward the far-fetched: The sitting U.S. president -- let's call him Bartlet -- initiates a ""peace process."" Laborious negotiations ensue involving the federal government, the Texas chapters of the Democratic and Republican parties, a political front for the HRA, and Mexico. (As to why the U.S. would negotiate with a foreign country over a state in the union, just suspend your disbelief.) Charitably, the HRA offers to refrains from blowing up bars or assassinating presidents. At last they hammer out a deal, to international celebration. No more carnage!</p><p style='font-size:12pt;font-weight:400;'>But that's not the end of the story, because ""peace"" doesn't come cheap. Texas is still a star in Old Glory, but the American flag is put out of view in public places lest it alienate Hispanics. A complex bureaucratic apparatus now links Austin and Mexico City to coordinate social policy. President Bartlet doesn't dare sneeze in Texas without asking the Mexican president's permission, and all statements in relation to the Lone Star state are issued jointly with the Mexican government.</p><p style='font-size:12pt;font-weight:400;'>It gets weirder: Every HRA sniper and bomber that the FBI apprehended gets to go home, though many have just started life sentences. Picture a swarthier Timothy McVeigh -- who in our page-turner walks off death row a free man, met by a cheering crowd and a pitcher of margarita. The Texas state police force, which did so much to keep the HRA from killing even more people than it did, is drastically downsized and renamed. Made to feel ashamed, droves of experienced anti-terrorist officers retire early. A powerful police ombudsman is imported from Mexico, as is an ""oversight commissioner"" from France. Americans can no longer be trusted to run their own police.</p><p style='font-size:12pt;font-weight:400;'>Most painfully, HRA leaders are ushered into Texas state government, and a self-confessed HRA commander is awarded the post of commissioner of education. The Texas governor says he can tolerate working with murderers on only one condition: The HRA must destroy at least some of its 100-ton illegal arsenal, which it has kept for a rainy day.</p><p style='font-size:12pt;font-weight:400;'>So, does Mr. Bartlet get tough? No, the president of the U.S. grovels. With no promises from the HRA on disarmament (its representatives have proposed how they might theoretically disarm, but not when), he promises to withdraw the National Guard from Texas and to dismantle its outposts. He announces an amnesty for HRA men on the lam, giving about 60 desperadoes a clean record. He promises the secessionist leadership that convicted felons can infiltrate the Texas police force, and serve on its supervisory board.</p><p style='font-size:12pt;font-weight:400;'>All this happens even though a new dissident group is bombing D.C. again. (The ""Real"" HRA comprises disaffected HRA members who still think -- and you can see why, with such an accommodating federal government -- that they can win Texas by force.) Mr. Bartlet dangles the possibility of disbanding the FBI's Domestic Counter-Terrorism Program, which HRA people despise because it's been so effective at catching them red-handed.</p><p style='font-size:12pt;font-weight:400;'>You seem skeptical. Let killers out of jail, having served only one or two years? Not in the U.S. of A! Convicted murderers in the police, supervising police operations? As if! Decisions on the National Guard and FBI made solely on the basis of demands by a bunch of unelected terrorists? A ridiculous book! It'll never sell.</p><p style='font-size:12pt;font-weight:400;'>Your mistake. It has sold -- foreign rights.</p><p style='font-size:12pt;font-weight:400;'>British Prime Minister Tony Blair uses the fact that mainland Britons (and Americans) are bored and confused by Northern Ireland. Awkward formulations like ""putting arms beyond use"" -- in deference to terrorists' delicate sensibilities -- and lofty calls for peace disguise the fact that he is selling out his law-abiding countrymen for the sake of short-term expedience. The details of the latest shenanigans -- London's suspension of Belfast's assembly and its resumption 24 hours later, the equally theatrical submission and retraction of a vague IRA ""offer"" to disarm -- are unimportant, though their bureaucratic and rhetorical complexity, for both parties, is usefully obfuscating.</p><p style='font-size:12pt;font-weight:400;'>I cling to the conviction that no U.S. president would make major decisions about American security in accordance with the wishes of people like McVeigh. It's unimaginable that Americans would tolerate a commander-in-chief who installed unrepentant terrorists in executive positions of a state government, invited convicted murderers to join and oversee a virtually dismantled state police force, and released wholesale into the community felons after risibly short sentences.</p><p style='font-size:12pt;font-weight:400;'>Oklahoma City aside, Americans have been lucky with respect to domestic terrorism. As it becomes easier technologically for small groups to cause mass casualties, that luck may not hold. If we ever are subjected to such a movement within our borders, we are likely to look to places like Northern Ireland for solutions, only to discover that the British government has prostrated itself before killers, lavishing a terrorist movement with every political gratuity it can think of -- throwing pearls before swine. Ulster sets a disturbing precedent. To avoid abridging the most fundamental democratic principles, we may be forced to turn elsewhere.</p><p style='font-size:12pt;font-weight:400;'>---</p><p style='font-size:12pt;font-weight:400;'>Ms. Shriver is a London-based American novelist and journalist who lived for 12 years in Belfast.</p><p style='font-size:12pt;font-weight:400;'>(See related letter: Letters to the Editor: The `Void' in the British System"" -- WSJ Sept. 5, 2001)</p></div>"			2	2				
